filename,text,type,slug
"El_hombre_necesita_entrar_al_baño_urgente,_tiene_malestar_de_estómago._Entra_al_baño_y_mira_por_todos_lados._¡No_hay_papel_higiénico!,_¡Carajo!.mp4","El hombre necesita entrar al baño urgente, tiene malestar de estómago. Entra al baño y mira por todos lados. ¡No hay papel higiénico!, ¡Carajo!","example","papel-higienico"
"Parecer.m4v","Parecer","word","parecer"
"Tener_algo_o_alguien_rasgos_semejantes_a_la_de_otra_cosa_o_persona.m4v","Tener algo o alguien rasgos semejantes a la de otra cosa o persona.","definition","parecer"
"Voy_caminando_por_el_parqueadero_y_está_lleno._Pienso_¿dónde_está_mi_carro_Esos_dos_carros_parecen_iguales._¡Ah,_éste_es_el_mío¡.m4v","Voy caminando por el parqueadero y está lleno. Pienso: ""¿dónde está mi carro? Esos dos carros parecen iguales. ¡Ah, éste es el mío¡""","example","parecer"
"Pensar_(1).m4v","Pensar (1)","word","pensar-1"
"Formar_ideas_y_conceptos_en_la_mente,_relacionándolos_unos_con_otros.m4v","Formar ideas y conceptos en la mente, relacionándolos unos con otros.","definition","pensar-1"
"Yo_pienso_como_crear_un_poema_en_lengua_de_señas.m4v","Yo pienso como crear un poema en lengua de señas.","example","pensar-1"
"Peluquería.m4v","Peluquería","word","peluqueria"
"Lugar_donde_se_corta,_cuida_y_arregla_el_cabello.m4v","Lugar donde se corta, cuida y arregla el cabello.","definition","peluqueria"
"El_jefe_me_avisó_debe_ir_a_hacer_una_grabación_en_lengua_de_señas._Yo_le_dije_¡Espere!_Primero_tengo_que_ir_a_la_peluquería.m4v","El jefe me avisó: ""debe ir a hacer una grabación en lengua de señas"". Yo le dije: ""¡Espere! Primero tengo que ir a la peluquería"".","example","peluqueria"
"Pase.mp4","Pase","word","pase"
"Documento_que_certifica_oficialmente_la_licencia_para_conducir_un_vehículo_automotor.mp4","Documento que certifica oficialmente la licencia para conducir un vehículo automotor.","definition","pase"
"Al_conducir_la_motocicleta,_el_agente_de_tránsito_le_pidió_el_pase_de_conducción,_y_tras_la_revisión_de_la_moto,_el_motociclista_pudo_continuar_su_camino.mp4","Al conducir la motocicleta, el agente de tránsito le pidió el pase de conducción, y tras la revisión de la moto, el motociclista pudo continuar su camino.","example","pase"
"Pasear.m4v","Pasear","word","pasear"
"Recorrer_lugares_por_diversión_y_por_gusto.m4v","Recorrer lugares por diversión y por gusto.","definition","pasear"
"Mi_amigo_anciano_me_dice_yo_quiero_ir_al_paseo_a_la_Guajira._Yo_le_digo_Vamos.m4v","Mi amigo anciano me dice: ""yo quiero ir al paseo a la Guajira"". Yo le digo: ""Vamos"".","example","pasear"
"Pena.m4v","Pena","word","pena"
"Sentimiento_de_vergüenza_o_humillación.m4v","Sentimiento de vergüenza o humillación.","definition","pena"
"El_expositor_estaba_en_el_auditorio__realizando_una_ponencia_y_se_dio_cuenta_que_se_estaba_desviando_del_tema._Pensó_estoy_mal,_que_pena_y_se_fue.m4v","El expositor estaba en el auditorio  realizando una ponencia y se dio cuenta que se estaba desviando del tema. Pensó: ""estoy mal, que pena"" y se fue.","example","pena"
"Hijo_o_hija_de_su_tío_o_tía_con_respecto_a_una_persona.m4v","Hijo o hija de su tío o tía con respecto a una persona.","definition","primo"
"Yo_fui_con_mi_prima_a_recorrer_diferentes_partes_del_mundo.m4v","Yo fui con mi prima a recorrer diferentes partes del mundo.","example","primo"
"Pan.mp4","Pan","word","3571-2"
"Alimento_hecho_con_harina_y_cocinado_al_horno.mp4","Alimento hecho con harina y cocinado al horno.","definition","3571-2"
"Por_la_mañana,_el_estudiante_come_al_desayuno_chocolate,_pan_y_queso.mp4","Por la mañana, el estudiante come al desayuno chocolate, pan y queso.","example","3571-2"
"Pequeño_(1).m4v","Pequeño (1)","word","pequeno_1"
"Persona_que_tiene_poca_edad_o_estatura_menor.m4v","Persona que tiene poca edad o estatura menor.","definition","pequeno_1"
"Yo_vi_en_la_cancha_a_niños_pequeños_jugando_futbol._¡Que_bonitos¡.m4v","Yo vi en la cancha a niños pequeños jugando futbol. ¡Que bonitos¡","example","pequeno_1"
"Puente.m4v","Puente","word","puente"
"Construcción_aérea_para_agilizar_y_descongestionar_el_tráfico_en_las_ciudades.m4v","Construcción aérea para agilizar y descongestionar el tráfico en las ciudades.","definition","puente"
"Hace_poco_el_alcalde_de_Villavicencio_ganó_las_elecciones_y_va_a_concentrarse_en_apoyar_la_inversión_de_recursos_para_construir_puentes.m4v","Hace poco el alcalde de Villavicencio ganó las elecciones y va a concentrarse en apoyar la inversión de recursos para construir puentes.","example","puente"
"Piano.m4v","Piano","word","piano"
"Instrumento_musical_de_cuerda_provisto_de_un_teclado.m4v","Instrumento musical de cuerda provisto de un teclado.","definition","piano"
"Al_auditorio,_en_el_que_había_un_piano,_entraron_varias_personas_y_se_llenó.__Llegó_un_pianista_experto_y_tocó_una_pieza_musical_que_todos_disfrutaron.m4v","Al auditorio, en el que había un piano, entraron varias personas y se llenó.  Llegó un pianista experto y tocó una pieza musical que todos disfrutaron.","example","piano"
"Poder.m4v","Poder","word","poder"
"Tener_la_capacidad,_el_tiempo_o_la_posibilidad_de_hacer_una_cosa.m4v","Tener la capacidad, el tiempo o la posibilidad de hacer una cosa.","definition","poder"
"En_el_partido_de_futbol_ellos_fueron_mejores_que_nosotros_y_yo_les_digo_a_mis_compañeros_Nosotros_podemos_ser_mejores_que_ellos.m4v","En el partido de futbol ellos fueron mejores que nosotros y yo les digo a mis compañeros: ""Nosotros podemos ser mejores que ellos"".","example","poder"
"Patinaje_(1).m4v","Patinaje (1)","word","patinaje_1"
"Deporte_que_consiste_en_correr_sobre_patines_con_cuatro_ruedas.m4v","Deporte que consiste en correr sobre patines con cuatro ruedas","definition","patinaje_1"
"Un_grupo_de_niños_están_patinando_y_ven_a_un_amigo_anciano_patinando_con_gran_habilidad.m4v","Un grupo de niños están patinando y ven a un amigo anciano patinando con gran habilidad.","example","patinaje_1"
"Patinaje_(2).m4v","Patinaje (2)","word","patinaje_2"
"Deporte_que_consiste_en_correr_sobre_patines_de_ruedas_ubicadas_en_fila_o_con_cuchilla.m4v","Deporte que consiste en correr sobre patines de ruedas ubicadas en fila o con cuchilla.","definition","patinaje_2"
"Un_profesional_en_patinaje_de_Colombia_corre_a_gran_velocidad_en_la_prueba_contra_reloj.m4v","Un profesional en patinaje de Colombia corre a gran velocidad en la prueba contra reloj.","example","patinaje_2"
"Pensar_(2).m4v","Pensar (2)","word","pensar-2"
"Examinar_un_asunto_o_idea_con_cuidado,_reflexionar.m4v","Examinar un asunto o idea con cuidado, reflexionar.","definition","pensar-2"
"Yo_tengo_una_situación_económica_difícil,_no_tengo_planta._Pienso_¿Quién_me_la_puede_prestar.m4v","Yo tengo una situación económica difícil, no tengo planta. Pienso: ""¿Quién me la puede prestar?""","example","pensar-2"
"Puntual.m4v","Puntual","word","puntual"
"Que_nunca_llega_tarde,_sino_a_la_hora_exacta_en_diferentes_situaciones.m4v","Que nunca llega tarde, sino a la hora exacta en diferentes situaciones.","definition","puntual"
"Empezamos_la_reunión_y_esa_persona_llegó_cumplida.m4v","Empezamos la reunión y esa persona llegó cumplida.","example","puntual"
"Problema.m4v","Problema","word","problema"
"Hecho_o_circunstancia_que_dificulta_alcanzar_un_fin.m4v","Hecho o circunstancia que dificulta alcanzar un fin.","definition","problema"
"Mi_papá_y_yo_tenemos_problemas_debido_a_deudas_de_plata.m4v","Mi papá y yo tenemos problemas debido a deudas de plata.","example","problema"
"Por_la_mañana.m4v","Por la mañana","word","por-la-manana"
"Período_de_tiempo_que_va_desde_el_amanecer_hasta_el_mediodía.m4v","Período de tiempo que va desde el amanecer hasta el mediodía.","definition","por-la-manana"
"Por_la_mañana,_iré_a_visitar_a_mi_mamá_para_conversar.m4v","Por la mañana, iré a visitar a mi mamá para conversar.","example","por-la-manana"
"Perfume.mp4","Perfume","word","perfume"
"Sustancia_o_líquido_aromático_utilizado_para_dar_un_olor_agradable_a_la_persona.mp4","Sustancia o líquido aromático utilizado para dar un olor agradable a la persona.","definition","perfume"
"Mi_novia_compró_un_perfume_y_me_lo_regaló._Yo_estaba_contento.mp4","Mi novia compró un perfume y me lo regaló. Yo estaba contento.","example","perfume"
"Papa.mp4","Papa","word","papa-1"
"Tubérculo_que_se_utiliza_como_alimento,_rico_en_almidón.mp4","Tubérculo que se utiliza como alimento, rico en almidón.","definition","papa-1"
"Tenemos_una_olla,_le_echamos_agua,_papa_picada_y_diferentes_verduras._Se_revuelve_y_queda_una_sopa_rica.mp4","Tenemos una olla, le echamos agua, papa picada y diferentes verduras. Se revuelve y queda una sopa rica.","example","papa-1"
"Próximo.m4v","Próximo","word","proximo"
"Que_está_cerca_en_el_tiempo.m4v","Que está cerca en el tiempo.","definition","proximo"
"El_próximo_mes,_hay_un_simposio_nacional_sobre_sordos.m4v","El próximo mes, hay un simposio nacional sobre sordos.","example","proximo"
"Pobre.m4v","Pobre","word","pobre"
"Persona_que_carece_de_lo_necesario_para_vivir_o_lo_tiene_muy_limitado.m4v","Persona que carece de lo necesario para vivir o lo tiene muy limitado.","definition","pobre"
"La_familia_vive_en_una_casa_pobre,_pero_ellos_luchan_y_se_esfuerzan_por_lo_cual_logran_trabajar_y_pagar_el_estudio_en_la_universidad.m4v","La familia vive en una casa pobre, pero ellos luchan y se esfuerzan por lo cual logran trabajar y pagar el estudio en la universidad.","example","pobre"
"Poco.m4v","Poco","word","poco"
"Que_es_pequeño_en_cantidad,_reducido_en_elementos,_en_tiempo_o_en_grado_al_realizar_una_acción.m4v","Que es pequeño en cantidad, reducido en elementos, en tiempo o en grado al realizar una acción","definition","poco"
"El_plato_con_mucha_comida._No,_con_poca.m4v","El plato con mucha comida. No, con poca.","example","poco"
"Panadería.m4v","Panadería","word","panaderia"
"Establecimiento_donde_se_fabrica_y_vende_pan.m4v","Establecimiento donde se fabrica y vende pan.","definition","panaderia"
"Todos_los_días_por_la_mañana_voy_a_la_panadería,_me_siento_y_me_traen_chocolate,_pan_y_roscón._Cuando_los_como,_siempre_están_deliciosos.m4v","Todos los días por la mañana voy a la panadería, me siento y me traen chocolate, pan y roscón. Cuando los como, siempre están deliciosos.","example","panaderia"
"Pasta.mp4","Pasta","word","pasta"
"Masa_hecha_de_harina_de_trigo_y_agua;_recibe_nombres_tales_como_fideos,_macarrones,_tallarines,_etc.mp4","Masa hecha de harina de trigo y agua; recibe nombres tales como fideos, macarrones, tallarines, etc.","definition","pasta"
"Mi_abuela_tiene_conocimiento_y_habilidad_para_la_cocina._Prepara_una_pasta_con_queso,_que_le_queda_muy_rica.mp4","Mi abuela tiene conocimiento y habilidad para la cocina. Prepara una pasta con queso, que le queda muy rica.","example","pasta"
"Paciencia.m4v","Paciencia","word","paciencia"
"Capacidad_para_esperar_y_realizar_tranquilamente_una_acción.m4v","Capacidad para esperar y realizar tranquilamente una acción.","definition","paciencia"
"Un_hombre_fue_al_banco_a_realizar_un_pago,_pero_cuando_entró_se_dio_cuenta_que_la_fila_estaba_muy_larga._Le_tocó__tener_paciencia,_hizo_la_fila_y_pagó.m4v","Un hombre fue al banco a realizar un pago, pero cuando entró se dio cuenta que la fila estaba muy larga. Le tocó  tener paciencia, hizo la fila y pagó.","example","paciencia"
"Perro_Caliente.mp4","Perro Caliente","word","perro-caliente"
"Comida,_preparada_con_pan_al_que_se_le_introduce_una_salchicha_y_salsas.mp4","Comida, preparada con pan al que se le introduce una salchicha y salsas.","definition","perro-caliente"
"Tengo_mucha_hambre,_le_digo_a_mi_novio_que_si_quiera_ir_a_comprar_perro_caliente.mp4","Tengo mucha hambre, le digo a mi novio que si quiera ir a comprar perro caliente.","example","perro-caliente"
"Perder_(1).m4v","Perder (1)","word","perder_1"
"No_encontrar_o_saber_dónde_está_una_cosa,_una_persona_o_un_animal_que_se_tenía;_desaparecer.m4v","No encontrar o saber dónde está una cosa, una persona o un animal que se tenía; desaparecer.","definition","perder_1"
"Pollo.mp4","Pollo","word","pollo"
"Cría_de_la_gallina,_destinada_para_la_alimentación.mp4","Cría de la gallina, destinada para la alimentación.","definition","pollo"
"En_la_cena_de_navidad_del_año_pasado,_yo_vi_en_la_mesa_pollo,_pavo,_vino_y_otras_comidas._¡Muy_ricas!.mp4","En la cena de navidad del año pasado, yo vi en la mesa: pollo, pavo, vino y otras comidas. ¡Muy ricas!","example","pollo"
"Padres.m4v","Padres","word","padres"
"Hombre_y_mujer_con_respecto_a_los_hijos_que_han_tenido.m4v","Hombre y mujer con respecto a los hijos que han tenido.","definition","padres"
"Avisan_del_colegio_a_los_padres_que_deben_asistir_el_próximo_viernes_para_la_entrega_de_calificaciones.m4v","Avisan del colegio a los padres que deben asistir el próximo viernes para la entrega de calificaciones.","example","padres"
"Papelería.m4v","Papelería","word","papeleria"
"Almacén_en_donde_se_vende_papel_y_material_de_oficina.m4v","Almacén en donde se vende papel y material de oficina.","definition","papeleria"
"El_profesor_estaba_escribiendo_en_el_tablero_con_un_marcador_y_se_le_acabó._Necesitó_ir_a_la_papelería_a_comprar_un_marcador_nuevo_para_seguir_escribiendo.m4v","El profesor estaba escribiendo en el tablero con un marcador y se le acabó. Necesitó ir a la papelería a comprar un marcador nuevo para seguir escribiendo.","example","papeleria"
"Pañal.m4v","Pañal","word","panal"
"Pieza_de_celulosa,_gasa_o_tela_absorbente_que_se_pone_a_los_bebés_o_a_personas_con_incontinencia,_para_recoger_la_orina_y_el_excremento.m4v","Pieza de celulosa, gasa o tela absorbente que se pone a los bebés o a personas con incontinencia, para recoger la orina y el excremento.","definition","panal"
"Estoy_alzando_a_mi_bebé,_me_doy_cuenta_que_huele_feo._Busco_un_pañal_¡Ah._No_hay!.m4v","Estoy alzando a mi bebé, me doy cuenta que huele feo. Busco un pañal ¡Ah. No hay!.","example","panal"
"Pantalón.mp4","Pantalón","word","pantalon"
"Prenda_de_vestir_que_se_ajusta_a_la_cintura_y_cubre_las_piernas_por_separado.mp4","Prenda de vestir que se ajusta a la cintura y cubre las piernas por separado.","definition","pantalon"
"Una_persona_está_buscando_un_pantalón,_lo_encuentra,_se_lo_mide_y_le_queda_perfecto.mp4","Una persona está buscando un pantalón, lo encuentra, se lo mide y le queda perfecto.","example","pantalon"
"Parqueadero.m4v","Parqueadero","word","parqueadero"
"Lugar_en_la_vía_pública_o_en_un_edificio_donde_pueden_dejarse_los_vehículos.m4v","Lugar en la vía pública o en un edificio donde pueden dejarse los vehículos.","definition","parqueadero"
"En_las_diferentes_ciudades_de_Colombia_el_precio_de_una_hora_de_parqueadero_es_caro.m4v","En las diferentes ciudades de Colombia el precio de una hora de parqueadero es caro.","example","parqueadero"
"Prestar.m4v","Prestar","word","prestar"
"Entregar_algo_a_alguien_para_que_lo_utilice_durante_algún_tiempo_y_después_lo_devuelva.m4v","Entregar algo a alguien para que lo utilice durante algún tiempo y después lo devuelva.","definition","prestar"
"Mi_suegro_me_acompaña_al_banco,_allí_leo_un_documento_y_lo_voy_a_firmar_pero_busco_un_esfero_y_no_tengo,_entonces_le_digo_Me_presta_un_esfero,_él_me_lo_presta_y_firmo_el_documento.m4v","Mi suegro me acompaña al banco, allí leo un documento y lo voy a firmar pero busco un esfero y no tengo, entonces le digo: ""Me presta un esfero"", él me lo presta y firmo el documento.","example","prestar"
"Pedir.m4v","Pedir","word","pedir"
"Rogar_o_demandar_que_se_dé_o_se_haga_alguna_cosa.m4v","Rogar o demandar que se dé o se haga alguna cosa.","definition","pedir"
"Una_persona_está_cansada_de_no_encontrar_trabajo,_en_todas_partes_lo_rechazan._Un_amigo_le_dice_Pídale_ayuda_al_gobierno_para_conseguir_trabajo.m4v","Una persona está cansada de no encontrar trabajo, en todas partes lo rechazan. Un amigo le dice: ""Pídale ayuda al gobierno para conseguir trabajo"".","example","pedir"
"Pizza.mp4","Pizza","word","3611-2"
"Masa_de_harina_de_trigo_plana_y_redonda_sobre_la_que_se_ponen_distintos_alimentos_y_se_cocinan_al_horno.mp4","Masa de harina de trigo plana y redonda sobre la que se ponen distintos alimentos y se cocinan al horno.","definition","3611-2"
"Mi_sobrina_y_yo_miramos_la_carta_y_escogimos_una_piza_hawaiana.mp4","Mi sobrina y yo miramos la carta y escogimos una piza hawaiana","example","3611-2"
"Pequeño_(2).m4v","Pequeño (2)","word","pequeno_2"
"Animal_que_tiene_poca_edad_o_tamaño.m4v","Animal que tiene poca edad o tamaño","definition","pequeno_2"
"La_vaca_estaba_embarazada_y_tuvo_un_ternero_pequeño,_muy_bonito.m4v","La vaca estaba embarazada y tuvo un ternero pequeño, muy bonito.","example","pequeno_2"
"Ponque.mp4","Ponque","word","abrigo"
"Masa_de_harina_de_trigo_y_otros_ingredientes,_redonda_y_aplanada,_que_se_cocina_en_el_horno.mp4","Masa de harina de trigo y otros ingredientes, redonda y aplanada, que se cocina en el horno.","definition","abrigo"
"A_mí_me_gusta_el_ponqué_con_arequipe_en_el_centro._¡Es_muy_rico!.mp4","A mí me gusta el ponqué con arequipe en el centro. ¡Es muy rico!","example","abrigo"
"Practicar.m4v","Practicar","word","practicar"
"Realizar_una_actividad_continuamente,_con_el_fin_de_dominarla.m4v","Realizar una actividad continuamente, con el fin de dominarla.","definition","practicar"
"Una_mujer_quiere_comprar_una_moto,_pero_no_sabe_cómo_manejarla._Necesita_practicar_mucho_y_con_el_tiempo_la_manejará_ágilmente.m4v","Una mujer quiere comprar una moto, pero no sabe cómo manejarla. Necesita practicar mucho y con el tiempo la manejará ágilmente.","example","practicar"
"Pronto.m4v","Pronto","word","pronto"
"En_poco_tiempo,_en_breve.m4v","En poco tiempo, en breve.","definition","pronto"
"Mi_esposa_estaba_en_Panamá_y_pronto_aterriza_su_avión.m4v","Mi esposa estaba en Panamá y pronto aterriza su avión.","example","pronto"
"Partido.m4v","Partido","word","partido"
"Competencia_o_juego_en_que_se_enfrentan_dos_jugadores_o_equipos.m4v","Competencia o juego en que se enfrentan dos jugadores o equipos.","definition","partido"
"Los_equipos_de_la_Sociedad_de_Sordos_de_Bogotá_y_la_Asociación_de_Sordos_de_Medellín_se_enfrentan_en_un_partido_de_baloncesto.m4v","Los equipos de la Sociedad de Sordos de Bogotá y la Asociación de Sordos de Medellín se enfrentan en un partido de baloncesto.","example","partido"
"Panela.mp4","Panela","word","panela"
"Azúcar_obtenida_del_procesamiento_de_la_miel_de_la_caña_de_azúcar_que_se_fabrica_en_bloques.mp4","Azúcar obtenida del procesamiento de la miel de la caña de azúcar que se fabrica en bloques.","definition","panela"
"Mis_abuelos_en_su_finca_venden_panela_y_tienen_buenas_ganancias.mp4","Mis abuelos en su finca venden panela y tienen buenas ganancias.","example","panela"
"Perezoso.m4v","Perezoso","word","perezoso"
"Persona_que_no_está_dispuesta_a_hacer_algo_o_lo_hace_con_lentitud_y_desgano.m4v","Persona que no está dispuesta a hacer algo o lo hace con lentitud y desgano.","definition","perezoso"
"La_secretaria_es_perezosa,_yo_veo_que_no_hace_nada.m4v","La secretaria es perezosa, yo veo que no hace nada.","example","perezoso"
"Participar.m4v","Participar","word","participar"
"Tomar_parte_en_alguna_cosa.m4v","Tomar parte en alguna cosa.","definition","participar"
"Hay_un_grupo_de_personas_oyentes__reunidas_hablando_sobre_lengua_de_señas_y_llega_una_persona_sorda_que_pide_el_turno_porque_quiere_participar.m4v","Hay un grupo de personas oyentes  reunidas hablando sobre lengua de señas y llega una persona sorda que pide el turno porque quiere participar.","example","participar"
"Papá.m4v","Papá","word","papa"
"Padre,_hombre_con_respecto_a_los_hijos_que_tenga.m4v","Padre, hombre con respecto a los hijos que tenga.","definition","papa"
"Mi_papá_trabajó_durante_mucho_tiempo_en_Cali.m4v","Mi papá trabajó durante mucho tiempo en Cali.","example","papa"
"Preocupar.m4v","Preocupar","word","preocupar"
"Pensar_constantemente_en_una_cosa_o_situación_que_causa_inquietud,_temor_o_ansiedad.m4v","Pensar constantemente en una cosa o situación que causa inquietud, temor o ansiedad.","definition","preocupar"
"Estoy_muy_preocupada_porque_estoy_atrasada_en_la_tesis_y__debo_entregarla_al_profesor.m4v","Estoy muy preocupada porque estoy atrasada en la tesis y  debo entregarla al profesor.","example","preocupar"
"Pesimista.m4v","Pesimista","word","pesimista"
"Personas_que_espera_siempre_lo_peor.m4v","Personas que espera siempre lo peor.","definition","pesimista"
"Mi_amiga_es_pesimista_y_dice_no_puedo_trabajar._Yo_le_digo__tranquilízate,_deja_de_repetir_eso,_ten_paciencia,_con_el_tiempo_vas_a_tener_suerte_y_conseguirás_trabajo.m4v","Mi amiga es pesimista y dice: ""no puedo trabajar"". Yo le digo: "" tranquilízate, deja de repetir eso, ten paciencia, con el tiempo vas a tener suerte y conseguirás trabajo"".","example","pesimista"
"Prohibir.m4v","Prohibir","word","prohibir"
"Vedar_o_impedir_el_uso_o_ejecución_de_una_cosa.m4v","Vedar o impedir el uso o ejecución de una cosa.","definition","prohibir"
"Un_hombre_sale_como_siempre_con_su_perro_a_caminar_y_de_repente_tiene_una_idea_¡Ah,_voy_a_entrar_al_centro_comercial,_cuando_van_a_entrar_el_vigilante_le_informa_Está_prohibido_ingresar_con_animales..m4v","Un hombre sale como siempre con su perro a caminar y de repente tiene una idea: ""¡Ah, voy a entrar al centro comercial"", cuando van a entrar el vigilante le informa: ""Está prohibido ingresar con animales"". El hombre piensa:""¡Ah, lástima!""","example","prohibir"
"Quince.m4v","Quince","word","quince"
"Diez_y_cinco.m4v","Diez y cinco.","definition","quince"
"En_Pereira_por_la_noche_siempre_hace_frio,_la_temperatura_es_usualmente_de_quince_grados.m4v","En Pereira por la noche siempre hace frio, la temperatura es usualmente de quince grados.","example","quince"
"Queso.m4v","Queso","word","queso"
"Alimento_que_se_obtiene_de_la_leche_cuando_se_cuaja.m4v","Alimento que se obtiene de la leche cuando se cuaja.","definition","queso"
"Cuando_iba_de_viaje_en_el__carro,_me_dio__mucha_hambre_y_como_llevaba_manzana,__pera_y_queso,_me_los_comí.m4v","Cuando iba de viaje en el  carro, me dio  mucha hambre y como llevaba manzana,  pera y queso, me los comí.","example","queso"
"Querer.m4v","Querer","word","querer"
"Tener_el_deseo,_la_voluntad_de_obtener_o_de_hacer_algo.m4v","Tener el deseo, la voluntad de obtener o de hacer algo.","definition","querer"
"Yo_estoy_pensando_que_en_el_futuro_quiero_inscribirme_para_estudiar_en_la_Universidad_de_Gallaudet_que_es_solo_para_sordos.m4v","Yo estoy pensando que en el futuro quiero inscribirme para estudiar en la Universidad de Gallaudet que es solo para sordos.","example","querer"
"Religión_(1).m4v","Religión (1)","word","religion-1"
"El_profesor_les_asigna_a_los_estudiantes_una_tarea_de_religión._Deben_buscar_información_sobre_qué_es_Dios_y_tomar_apuntes_para_presentarlos.m4v","El profesor les asigna a los estudiantes una tarea de religión. Deben buscar información sobre qué es Dios y tomar apuntes para presentarlos.","definition","religion-1"
"Tiene_un_examen_al_día_siguiente_y_está_nervioso._Ora_a_Dios_pidiendo_ayuda._A_la_mañana_siguiente_presenta_el_examen_y_obtiene_buenos_resultados_por_lo_que_le_agradece_a_Dios.m4v","Tiene un examen al día siguiente y está nervioso. Ora a Dios pidiendo ayuda. A la mañana siguiente presenta el examen y obtiene buenos resultados por lo que le agradece a Dios.","example","religion-1"
"Responsable.m4v","Responsable","word","responsable"
"Que_cumple_o_se_hace_cargo_de_sus_obligaciones.m4v","Que cumple o se hace cargo de sus obligaciones.","definition","responsable"
"Me_gusta_ser_responsable,_para_eso_necesito_ser_activa,_cuidar_los_hijos,_organizar_la_casa,_trabajar_y_hacer_todo._¡Eso_me_fascina¡.m4v","Me gusta ser responsable, para eso necesito ser activa, cuidar los hijos, organizar la casa, trabajar y hacer todo. ¡Eso me fascina¡","example","responsable"
"Radiografía.m4v","Radiografía","word","radiografia"
"Fotografía_realizada_por_medio_de_rayos_X,_para_hacer_un_examen_de_los_órganos_internos_del_cuerpo_humano.m4v","Fotografía realizada por medio de rayos X, para hacer un examen de los órganos internos del cuerpo humano.","definition","radiografia"
"Un_futbolista_estaba_en_un_partido_y_otro_jugador__le_pegó_en_la__pierna_y_se_le_partió._Lo_llevaron_al_médico_y_le_sacaron_una_radiografía.m4v","Un futbolista estaba en un partido y otro jugador  le pegó en la  pierna y se le partió. Lo llevaron al médico y le sacaron una radiografía.","example","radiografia"
"Respetar.m4v","Respetar","word","respetar"
"Asumir_una_actitud_de_atención,_cuidado_y_cortesía_frente_a_alguien_o_algo.m4v","Asumir una actitud de atención, cuidado y cortesía frente a alguien o algo.","definition","respetar"
"El_perro_estaba_durmiendo_y_el_niño_pensó_voy_aprovechar_para_molestarlo_El_papá_se_dio_cuenta_y_le_dijo_“¡Espere,_por_favor_respete,_déjelo_dormir!.m4v","El perro estaba durmiendo y el niño pensó: ""voy aprovechar para molestarlo"" El papá se dio cuenta y le dijo: “¡Espere, por favor respete, déjelo dormir!"".","example","respetar"
"Recordar.m4v","Recordar","word","recordar"
"Traer_a_la_memoria_una_persona,_un_hecho,_una_idea,_una_experiencia,_etc.m4v","Traer a la memoria una persona, un hecho, una idea, una experiencia, etc.","definition","recordar"
"Yo_recuerdo_que_hace_tiempo,_cuando_era_joven,_a_los_dieciocho__años,_yo_tuve_una_novia_que_me_hizo_daño_y_nos_separamos.m4v","Yo recuerdo que hace tiempo, cuando era joven, a los dieciocho  años, yo tuve una novia que me hizo daño y nos separamos.","example","recordar"
"Religión_(2).m4v","Religión (2)","word","religion-2"
